{
  "assets": {
    "accounts": [
      {
        "account_id": "a1",
        "balance": "30265.15",
        "kind": "checking",
        "statements_doc_ids": [
          "d5a10",
          "d5a11"
        ]
      },
      {
        "account_id": "a2",
        "balance": "20176.77",
        "kind": "savings",
        "statements_doc_ids": [
          "d5a20",
          "d5a21"
        ]
      }
    ],
    "down_payment_source": "checking a1",
    "gift_funds": [],
    "retirement_accounts": []
  },
  "borrowers": [
    {
      "borrower_id": "b1",
      "dob": "1988-04-02",
      "employment": [
        {
          "distance_to_property_miles_sidecar": 12,
          "employer": "Evergreen Manufacturing Co",
          "monthly_base_income_stated": "24954.61",
          "position": "Operations Manager",
          "start_date": "2019-03-01"
        }
      ],
      "full_name": "Quinn Petrov",
      "is_primary": true,
      "self_employed": false,
      "ssn": "900-42-7488",
      "stated_other_income": [],
      "voe_sidecar": {
        "result": "verified"
      }
    }
  ],
  "credit": {
    "derogatories": [],
    "key_factors": [
      "Proportion of balances to credit limits",
      "Length of revolving credit history"
    ],
    "open_disputes": 0,
    "permissible_purpose": "credit_transaction",
    "report_date": "2026-06-18",
    "score_range": {
      "high": 850,
      "low": 300
    },
    "scores": [
      {
        "borrower_id": "b1",
        "equifax": 780,
        "experian": 787,
        "transunion": 774
      }
    ],
    "tradelines": [
      {
        "balance": "34063.20",
        "derog": null,
        "dispute": false,
        "kind": "auto_loan",
        "late_30_count_12mo": 0,
        "monthly_payment": "1135.44",
        "payments_remaining": 30
      },
      {
        "balance": "42173.20",
        "derog": null,
        "dispute": false,
        "kind": "credit_card",
        "late_30_count_12mo": 0,
        "monthly_payment": "2108.66"
      }
    ]
  },
  "documents": [
    {
      "borrower_id": "b1",
      "doc_id": "d1",
      "doc_type": "paystub",
      "ground_truth": {
        "employer": "Evergreen Manufacturing Co",
        "gross_pay_period": "12477.30",
        "pay_date": "2026-06-25",
        "pay_frequency": "semi_monthly",
        "ytd_gross": "149727.60"
      },
      "period_label": "2026-06",
      "text_rendering": "EVERGREEN MANUFACTURING CO — EARNINGS STATEMENT\nEmployee: Quinn Petrov    Pay Date: 2026-06-25\nPay Frequency: Semi-Monthly\n----------------------------------------\n  Gross Pay (this period):   $12,477.30\n  YTD Gross:                 $149,727.60\n----------------------------------------\nDirect deposit to account on file.\n"
    },
    {
      "borrower_id": "b1",
      "doc_id": "d20",
      "doc_type": "w2",
      "ground_truth": {
        "employer": "Evergreen Manufacturing Co",
        "tax_year": 2025,
        "wages_box1": "299455.32"
      },
      "period_label": "2025",
      "text_rendering": "FORM W-2 — WAGE AND TAX STATEMENT — 2025\nEmployer: Evergreen Manufacturing Co\nEmployee: Quinn Petrov\nBox 1 Wages, tips, other compensation: $299,455.32\n"
    },
    {
      "borrower_id": "b1",
      "doc_id": "d21",
      "doc_type": "w2",
      "ground_truth": {
        "employer": "Evergreen Manufacturing Co",
        "tax_year": 2024,
        "wages_box1": "299455.32"
      },
      "period_label": "2024",
      "text_rendering": "FORM W-2 — WAGE AND TAX STATEMENT — 2024\nEmployer: Evergreen Manufacturing Co\nEmployee: Quinn Petrov\nBox 1 Wages, tips, other compensation: $299,455.32\n"
    },
    {
      "doc_id": "d5a10",
      "doc_type": "bank_statement",
      "ground_truth": {
        "deposits": [
          {
            "amount": "12477.30",
            "date": "2026-05-05",
            "description": "PAYROLL EVERGREEN MANUFA"
          },
          {
            "amount": "12477.30",
            "date": "2026-05-20",
            "description": "PAYROLL EVERGREEN MANUFA"
          }
        ],
        "ending_balance": "30265.15",
        "period_end": "2026-05-31",
        "period_start": "2026-05-01"
      },
      "period_label": "2026-05",
      "text_rendering": "LAKESIDE FEDERAL CU — ACCOUNT STATEMENT (...7711)\nStatement Period: 2026-05-01 through 2026-05-31\nDEPOSITS AND CREDITS\n  2026-05-05  DEPOSIT PAYROLL EVERGREEN MANUFA     $12,477.30\n  2026-05-20  DEPOSIT PAYROLL EVERGREEN MANUFA     $12,477.30\nENDING BALANCE: $30,265.15\n"
    },
    {
      "doc_id": "d5a20",
      "doc_type": "bank_statement",
      "ground_truth": {
        "deposits": [],
        "ending_balance": "20176.77",
        "period_end": "2026-05-31",
        "period_start": "2026-05-01"
      },
      "period_label": "2026-05",
      "text_rendering": "LAKESIDE FEDERAL CU — ACCOUNT STATEMENT (...7721)\nStatement Period: 2026-05-01 through 2026-05-31\nDEPOSITS AND CREDITS\n\nENDING BALANCE: $20,176.77\n"
    },
    {
      "doc_id": "d5a11",
      "doc_type": "bank_statement",
      "ground_truth": {
        "deposits": [
          {
            "amount": "12477.30",
            "date": "2026-06-05",
            "description": "PAYROLL EVERGREEN MANUFA"
          },
          {
            "amount": "12477.30",
            "date": "2026-06-20",
            "description": "PAYROLL EVERGREEN MANUFA"
          }
        ],
        "ending_balance": "30265.15",
        "period_end": "2026-06-30",
        "period_start": "2026-06-01"
      },
      "period_label": "2026-06",
      "text_rendering": "LAKESIDE FEDERAL CU — ACCOUNT STATEMENT (...7711)\nStatement Period: 2026-06-01 through 2026-06-30\nDEPOSITS AND CREDITS\n  2026-06-05  DEPOSIT PAYROLL EVERGREEN MANUFA     $12,477.30\n  2026-06-20  DEPOSIT PAYROLL EVERGREEN MANUFA     $12,477.30\nENDING BALANCE: $30,265.15\n"
    },
    {
      "doc_id": "d5a21",
      "doc_type": "bank_statement",
      "ground_truth": {
        "deposits": [],
        "ending_balance": "20176.77",
        "period_end": "2026-06-30",
        "period_start": "2026-06-01"
      },
      "period_label": "2026-06",
      "text_rendering": "LAKESIDE FEDERAL CU — ACCOUNT STATEMENT (...7721)\nStatement Period: 2026-06-01 through 2026-06-30\nDEPOSITS AND CREDITS\n\nENDING BALANCE: $20,176.77\n"
    },
    {
      "doc_id": "d6",
      "doc_type": "appraisal",
      "ground_truth": {
        "appraised_value": "805000.00",
        "condition_rating": "C3",
        "effective_date": "2026-06-20",
        "hazard_policy_type_hint": "Owner-occupied; standard hazard policy noted.",
        "property_type": "sfr_detached"
      },
      "text_rendering": "UNIFORM RESIDENTIAL APPRAISAL REPORT\nSubject Property: 3495 Synthetic Way, Austin, TX 78701\nProperty Type: sfr_detached\nOpinion of Market Value: $805,000.00\nEffective Date of Appraisal: 2026-06-20\nCondition Rating: C3\nRemarks: Owner-occupied; standard hazard policy noted.\n"
    },
    {
      "borrower_id": "b1",
      "doc_id": "d7",
      "doc_type": "urla_1003",
      "ground_truth": {
        "declarations": {
          "bankruptcy_7yr": false,
          "delinquent_federal_debt": false,
          "foreclosure_7yr": false,
          "occupancy_intent_primary": true,
          "outstanding_judgments": false,
          "party_to_lawsuit": false,
          "undisclosed_borrowed_funds": false
        },
        "employer_names": [
          "Evergreen Manufacturing Co"
        ],
        "stated_income_monthly": "24954.61",
        "stated_liabilities_monthly": "3244.10"
      },
      "text_rendering": "UNIFORM RESIDENTIAL LOAN APPLICATION (FORM 1003)\nBorrower: Quinn Petrov\nEmployers: Evergreen Manufacturing Co\nTotal Monthly Income: $24,954.61\nTotal Monthly Liabilities: $3,244.10\nDeclarations: [X] No outstanding judgments  [X] No bankruptcy (7yr)\n[X] No foreclosure (7yr)  [X] Will occupy as primary residence\n[X] No undisclosed borrowed funds\n"
    },
    {
      "doc_id": "d8",
      "doc_type": "tri_merge_credit",
      "text_rendering": "TRI-MERGE CREDIT REPORT — 2026-06-18\nRepresentative score data delivered in structured feed.\nReference score: 780\n"
    }
  ],
  "hmda_demographics": {
    "b1": {
      "age_band": "35-44",
      "ethnicity": "not_hispanic",
      "race": "white",
      "sex": "female"
    }
  },
  "liabilities_stated_monthly_total": "3244.10",
  "loan": {
    "amount": "624000.00",
    "apr": "6.400",
    "county_high_cost": false,
    "lender_controlled_fees": "6240.00",
    "loan_type": "conventional_conforming",
    "mlo_nmls_id": "1808904",
    "note_rate": "6.125",
    "occupancy": "primary",
    "purpose": "cash_out_refi",
    "term_months": 360,
    "total_points_and_fees": "13104.00"
  },
  "package_version": "1.0",
  "processor_computed": {
    "back_dti": "32.2",
    "front_dti": "19.2",
    "qualifying_income_monthly": "24954.61"
  },
  "property": {
    "address": {
      "city": "Austin",
      "county": "Travis",
      "state": "TX",
      "street": "3495 Synthetic Way",
      "zip": "78701"
    },
    "annual_hazard_insurance": "1800.00",
    "annual_taxes": "9600.00",
    "appraisal_effective_date": "2026-06-20",
    "appraised_value": "805000.00",
    "flood_zone_sidecar": "X",
    "hazard_policy_type": "owner_occupied",
    "monthly_hoa": "0.00",
    "property_type": "sfr_detached",
    "subordinate_liens": [],
    "tx_a6_notice_date": "2026-06-15",
    "units": 1
  }
}
